{
  "components": [
    {
      "index": 0,
      "name": "keen::ecs::DynamicActiveNpcState",
      "size": 136
    },
    {
      "index": 1,
      "name": "keen::ecs::ActiveNpcStateSaved",
      "size": 48
    },
    {
      "index": 2,
      "name": "keen::ecs::DynamicActiveNpcTarget",
      "size": 32
    },
    {
      "index": 3,
      "name": "keen::ecs::Actor",
      "size": 3600
    },
    {
      "index": 4,
      "name": "keen::ecs::ActorInput",
      "size": 440
    },
    {
      "index": 5,
      "name": "keen::ecs::ActorRotation",
      "size": 96
    },
    {
      "index": 6,
      "name": "keen::ecs::AddDestructibleOnLoot",
      "size": 4
    },
    {
      "index": 7,
      "name": "keen::ecs::AffectedByIncreasedPickupSkill",
      "size": 1
    },
    {
      "index": 8,
      "name": "keen::ecs::DynamicAggro",
      "size": 2848
    },
    {
      "index": 9,
      "name": "keen::ecs::Aging",
      "size": 4
    },
    {
      "index": 10,
      "name": "keen::ecs::AllyAggroMultiplier",
      "size": 40
    },
    {
      "index": 11,
      "name": "keen::ecs::AmbientHelper",
      "size": 1
    },
    {
      "index": 12,
      "name": "keen::ecs::DynamicAnimal",
      "size": 152
    },
    {
      "index": 13,
      "name": "keen::ecs::AnimalSaved",
      "size": 56
    },
    {
      "index": 14,
      "name": "keen::ecs::DynamicAnimalTarget",
      "size": 8
    },
    {
      "index": 15,
      "name": "keen::ecs::AnimalTestData",
      "size": 4
    },
    {
      "index": 16,
      "name": "keen::ecs::AnimalTestToggle",
      "size": 4
    },
    {
      "index": 17,
      "name": "keen::ecs::AnimatedCamera",
      "size": 1
    },
    {
      "index": 18,
      "name": "keen::ecs::AnimationGraphComponent2",
      "size": 28
    },
    {
      "index": 19,
      "name": "keen::ecs::AnimationGraphResourceComponent2",
      "size": 36
    },
    {
      "index": 20,
      "name": "keen::ecs::AnimationGraphSlotComponent",
      "size": 1732
    },
    {
      "index": 21,
      "name": "keen::ecs::Ao",
      "size": 1
    },
    {
      "index": 22,
      "name": "keen::ecs::ArachnophobiaModelToggle",
      "size": 16
    },
    {
      "index": 23,
      "name": "keen::ecs::Armor",
      "size": 56
    },
    {
      "index": 24,
      "name": "keen::ecs::ArmorPoints",
      "size": 148
    },
    {
      "index": 25,
      "name": "keen::ecs::DynamicAttachToSurface",
      "size": 24
    },
    {
      "index": 26,
      "name": "keen::ecs::AudioComponent",
      "size": 56
    },
    {
      "index": 27,
      "name": "keen::ecs::AudioComponentVolatile",
      "size": 72
    },
    {
      "index": 28,
      "name": "keen::ecs::AudioResourceComponent",
      "size": 16
    },
    {
      "index": 29,
      "name": "keen::ecs::BabyAnimal",
      "size": 40
    },
    {
      "index": 30,
      "name": "keen::ecs::BaseIdComponent",
      "size": 48
    },
    {
      "index": 31,
      "name": "keen::ecs::BaseShared",
      "size": 1
    },
    {
      "index": 32,
      "name": "keen::ecs::Block",
      "size": 40
    },
    {
      "index": 33,
      "name": "keen::ecs::BlockWater",
      "size": 56
    },
    {
      "index": 34,
      "name": "keen::ecs::BodyHeat",
      "size": 68
    },
    {
      "index": 35,
      "name": "keen::ecs::BodyHeatDepletion",
      "size": 4
    },
    {
      "index": 36,
      "name": "keen::ecs::BodyHeatMaxMod",
      "size": 52
    },
    {
      "index": 37,
      "name": "keen::ecs::BodyHeatRecharge",
      "size": 16
    },
    {
      "index": 38,
      "name": "keen::ecs::Boomerang",
      "size": 16
    },
    {
      "index": 39,
      "name": "keen::ecs::Boss",
      "size": 1
    },
    {
      "index": 40,
      "name": "keen::ecs::BossDisplay",
      "size": 16
    },
    {
      "index": 41,
      "name": "keen::ecs::BossHealthBar",
      "size": 20
    },
    {
      "index": 42,
      "name": "keen::ecs::BossMusicTag",
      "size": 16
    },
    {
      "index": 43,
      "name": "keen::ecs::BuffComponent",
      "size": 60
    },
    {
      "index": 44,
      "name": "keen::ecs::BuffContainer",
      "size": 472
    },
    {
      "index": 45,
      "name": "keen::ecs::BuffNetworkData",
      "size": 24
    },
    {
      "index": 46,
      "name": "keen::ecs::CSPDummy",
      "size": 1
    },
    {
      "index": 47,
      "name": "keen::ecs::CallFactionsForHelp",
      "size": 12
    },
    {
      "index": 48,
      "name": "keen::ecs::CastColliderShape",
      "size": 1
    },
    {
      "index": 49,
      "name": "keen::ecs::CharacterSetup",
      "size": 40
    },
    {
      "index": 50,
      "name": "keen::ecs::CheckLineAboveSensor",
      "size": 4
    },
    {
      "index": 51,
      "name": "keen::ecs::CheckPlayerInRange",
      "size": 1
    },
    {
      "index": 52,
      "name": "keen::ecs::ClearPathToTarget",
      "size": 8
    },
    {
      "index": 53,
      "name": "keen::ecs::ClientActiveNpcState",
      "size": 24
    },
    {
      "index": 54,
      "name": "keen::ecs::ClientActor",
      "size": 3128
    },
    {
      "index": 55,
      "name": "keen::ecs::ClientAnimationGraphInput",
      "size": 512
    },
    {
      "index": 56,
      "name": "keen::ecs::ClientAnimationGraphInputLerp",
      "size": 968
    },
    {
      "index": 57,
      "name": "keen::ecs::ClientAttachCursorOnHover",
      "size": 40
    },
    {
      "index": 58,
      "name": "keen::ecs::ClientBaseIdComponent",
      "size": 56
    },
    {
      "index": 59,
      "name": "keen::ecs::ClientCameraControl",
      "size": 56
    },
    {
      "index": 60,
      "name": "keen::ecs::ClientCharacter3CDebugCamera",
      "size": 1896
    },
    {
      "index": 61,
      "name": "keen::ecs::ClientCharacter3CDebugLocomotion",
      "size": 20864
    },
    {
      "index": 62,
      "name": "keen::ecs::ClientCollider",
      "size": 16
    },
    {
      "index": 63,
      "name": "keen::ecs::ClientCraftingInteraction",
      "size": 16
    },
    {
      "index": 64,
      "name": "keen::ecs::ClientCursor",
      "size": 4328
    },
    {
      "index": 65,
      "name": "keen::ecs::ClientCycleInventoryStock",
      "size": 4
    },
    {
      "index": 66,
      "name": "keen::ecs::ClientDismantleOverride",
      "size": 2
    },
    {
      "index": 67,
      "name": "keen::ecs::ClientDissolve",
      "size": 16
    },
    {
      "index": 68,
      "name": "keen::ecs::DynamicClientEnergyRotator",
      "size": 8
    },
    {
      "index": 69,
      "name": "keen::ecs::ClientEntitySpaceAnimationGraphSlotComponent",
      "size": 1732
    },
    {
      "index": 70,
      "name": "keen::ecs::ClientExtinguish",
      "size": 16
    },
    {
      "index": 71,
      "name": "keen::ecs::ClientFishing",
      "size": 8
    },
    {
      "index": 72,
      "name": "keen::ecs::ClientFishingFish",
      "size": 28
    },
    {
      "index": 73,
      "name": "keen::ecs::ClientFishingFloat",
      "size": 112
    },
    {
      "index": 74,
      "name": "keen::ecs::ClientFuelChangeFx",
      "size": 24
    },
    {
      "index": 75,
      "name": "keen::ecs::ClientHookShot",
      "size": 40
    },
    {
      "index": 76,
      "name": "keen::ecs::ClientInteractionCamera",
      "size": 1
    },
    {
      "index": 77,
      "name": "keen::ecs::ClientInteractionLock",
      "size": 1
    },
    {
      "index": 78,
      "name": "keen::ecs::ClientInteractionOffer",
      "size": 12
    },
    {
      "index": 79,
      "name": "keen::ecs::ClientInteractionQuery",
      "size": 8
    },
    {
      "index": 80,
      "name": "keen::ecs::ClientLineOfSightState",
      "size": 1
    },
    {
      "index": 81,
      "name": "keen::ecs::ClientLocomotion",
      "size": 48
    },
    {
      "index": 82,
      "name": "keen::ecs::ClientNoBuildZone",
      "size": 8
    },
    {
      "index": 83,
      "name": "keen::ecs::ClientNpcBed",
      "size": 4
    },
    {
      "index": 84,
      "name": "keen::ecs::ClientPlayerFocus",
      "size": 56
    },
    {
      "index": 85,
      "name": "keen::ecs::ClientPlayerInput",
      "size": 1392
    },
    {
      "index": 86,
      "name": "keen::ecs::ClientPlayerStaminaHints",
      "size": 24
    },
    {
      "index": 87,
      "name": "keen::ecs::ClientRangedWeapon",
      "size": 2
    },
    {
      "index": 88,
      "name": "keen::ecs::ClientRotationalEnergySource",
      "size": 8
    },
    {
      "index": 89,
      "name": "keen::ecs::ClientSubmerge",
      "size": 20
    },
    {
      "index": 90,
      "name": "keen::ecs::ClientToggle",
      "size": 2
    },
    {
      "index": 91,
      "name": "keen::ecs::ClientToggleFromActorState",
      "size": 24
    },
    {
      "index": 92,
      "name": "keen::ecs::ClientToggleState",
      "size": 16
    },
    {
      "index": 93,
      "name": "keen::ecs::ClientTransformationHistory",
      "size": 3856
    },
    {
      "index": 94,
      "name": "keen::ecs::DynamicClientUpgrade",
      "size": 4
    },
    {
      "index": 95,
      "name": "keen::ecs::ClientWaterFx",
      "size": 12
    },
    {
      "index": 96,
      "name": "keen::ecs::Climb",
      "size": 152
    },
    {
      "index": 97,
      "name": "keen::ecs::Collider",
      "size": 24
    },
    {
      "index": 98,
      "name": "keen::ecs::ColliderResourceComponent",
      "size": 8
    },
    {
      "index": 99,
      "name": "keen::ecs::CollisionFeedbackMaterialComponent",
      "size": 44
    },
    {
      "index": 100,
      "name": "keen::ecs::ColorPaletteItem",
      "size": 4
    },
    {
      "index": 101,
      "name": "keen::ecs::CombatFlags",
      "size": 12
    },
    {
      "index": 102,
      "name": "keen::ecs::CombatLifetimeCameraOverride",
      "size": 20
    },
    {
      "index": 103,
      "name": "keen::ecs::CombatStance",
      "size": 16
    },
    {
      "index": 104,